[
  {
    "question_id": "ART_001",
    "test_type": "abstract_reasoning",
    "difficulty": "easy",
    "category": "pattern_matrices",
    "question_content": {
      "type": "visual",
      "pattern_type": "matrix",
      "svg_data": "<svg viewBox='0 0 300 300'><rect x='50' y='50' width='40' height='40' fill='blue'/><rect x='110' y='50' width='40' height='40' fill='red'/><rect x='50' y='110' width='40' height='40' fill='red'/><text x='120' y='125' font-size='20'>?</text></svg>",
      "description": "Complete the 2x2 matrix pattern. The pattern shows alternating colors in each position."
    },
    "options": [
      { "option_id": "A", "content": { "type": "svg", "svg_data": "<svg viewBox='0 0 40 40'><rect width='40' height='40' fill='blue'/></svg>" } },
      { "option_id": "B", "content": { "type": "svg", "svg_data": "<svg viewBox='0 0 40 40'><rect width='40' height='40' fill='red'/></svg>" } },
      { "option_id": "C", "content": { "type": "svg", "svg_data": "<svg viewBox='0 0 40 40'><rect width='40' height='40' fill='green'/></svg>" } },
      { "option_id": "D", "content": { "type": "svg", "svg_data": "<svg viewBox='0 0 40 40'><rect width='40' height='40' fill='yellow'/></svg>" } }
    ],
    "correct_answer": "A",
    "explanation": "Colors alternate diagonally; missing should be blue.",
    "time_limit": 60,
    "points": 5,
    "metadata": { "created_date": "2025-08-27", "difficulty_rating": 3.5, "average_time": 35, "success_rate": 0.72 }
  },
  {
    "question_id": "ART_002",
    "test_type": "abstract_reasoning",
    "difficulty": "medium",
    "category": "shape_sequences",
    "question_content": {
      "type": "visual",
      "pattern_type": "sequence",
      "svg_data": "<svg viewBox='0 0 400 100'><circle cx='50' cy='50' r='20' fill='black'/><polygon points='120,30 140,70 100,70' fill='black'/><rect x='170' y='30' width='40' height='40' fill='black'/><circle cx='250' cy='50' r='20' fill='none' stroke='black' stroke-width='2'/><text x='320' y='55' font-size='20'>?</text></svg>",
      "description": "What comes next in this sequence? Shapes alternate between filled and outlined."
    },
    "options": [
      { "option_id": "A", "content": { "type": "svg", "svg_data": "<svg viewBox='0 0 80 80'><polygon points='40,20 60,60 20,60' fill='none' stroke='black' stroke-width='2'/></svg>" } },
      { "option_id": "B", "content": { "type": "svg", "svg_data": "<svg viewBox='0 0 80 80'><rect x='20' y='20' width='40' height='40' fill='none' stroke='black' stroke-width='2'/></svg>" } },
      { "option_id": "C", "content": { "type": "svg", "svg_data": "<svg viewBox='0 0 80 80'><circle cx='40' cy='40' r='20' fill='black'/></svg>" } },
      { "option_id": "D", "content": { "type": "svg", "svg_data": "<svg viewBox='0 0 80 80'><polygon points='40,20 60,60 20,60' fill='black'/></svg>" } }
    ],
    "correct_answer": "A",
    "explanation": "Filled → outlined → filled → outlined. Next is outlined triangle.",
    "time_limit": 90,
    "points": 5,
    "metadata": { "created_date": "2025-08-27", "difficulty_rating": 5.8, "average_time": 65, "success_rate": 0.56 }
  },
  {
    "question_id": "ART_003",
    "test_type": "abstract_reasoning",
    "difficulty": "hard",
    "category": "transformation_rules",
    "question_content": {
      "type": "visual",
      "pattern_type": "transformation",
      "svg_data": "<svg viewBox='0 0 500 200'><g transform='translate(50,50)'><rect width='30' height='30' fill='blue'/><circle cx='45' cy='15' r='10' fill='red'/></g><text x='150' y='70'>→</text><g transform='translate(200,50)'><rect width='30' height='30' fill='red'/><circle cx='45' cy='15' r='10' fill='blue'/></g><text x='300' y='70'>::</text><g transform='translate(350,50)'><polygon points='15,0 30,30 0,30' fill='green'/><rect x='35' y='10' width='20' height='10' fill='yellow'/></g><text x='450' y='70'>→ ?</text></svg>",
      "description": "Apply the same color-swap transformation to the second pair."
    },
    "options": [
      { "option_id": "A", "content": { "type": "svg", "svg_data": "<svg viewBox='0 0 80 80'><polygon points='40,20 60,60 20,60' fill='yellow'/><rect x='20' y='30' width='20' height='10' fill='green'/></svg>" } },
      { "option_id": "B", "content": { "type": "svg", "svg_data": "<svg viewBox='0 0 80 80'><polygon points='40,20 60,60 20,60' fill='green'/><rect x='45' y='30' width='20' height='10' fill='yellow'/></svg>" } },
      { "option_id": "C", "content": { "type": "svg", "svg_data": "<svg viewBox='0 0 80 80'><rect x='20' y='30' width='20' height='10' fill='green'/><polygon points='40,20 60,60 20,60' fill='yellow'/></svg>" } },
      { "option_id": "D", "content": { "type": "svg", "svg_data": "<svg viewBox='0 0 80 80'><polygon points='40,20 60,60 20,60' fill='yellow'/><rect x='45' y='30' width='20' height='10' fill='green'/></svg>" } }
    ],
    "correct_answer": "A",
    "explanation": "Rule swaps colors: triangle becomes yellow, rectangle becomes green.",
    "time_limit": 120,
    "points": 5,
    "metadata": { "created_date": "2025-08-27", "difficulty_rating": 7.2, "average_time": 95, "success_rate": 0.38 }
  },
  {
    "question_id": "ART_004",
    "test_type": "abstract_reasoning",
    "difficulty": "easy",
    "category": "odd_one_out",
    "question_content": {
      "type": "visual",
      "pattern_type": "odd_one_out",
      "svg_data": "<svg viewBox='0 0 400 100'><g transform='translate(20,25)'><circle cx='25' cy='25' r='20' fill='blue'/></g><g transform='translate(100,25)'><rect width='40' height='40' fill='blue'/></g><g transform='translate(180,25)'><polygon points='25,5 45,45 5,45' fill='blue'/></g><g transform='translate(260,25)'><circle cx='25' cy='25' r='20' fill='red'/></g><g transform='translate(340,25)'><rect width='40' height='40' fill='blue'/></g></svg>",
      "description": "Which shape is the odd one out?"
    },
    "options": [
      { "option_id": "A", "content": "Shape 1 (Blue Circle)" },
      { "option_id": "B", "content": "Shape 2 (Blue Square)" },
      { "option_id": "C", "content": "Shape 3 (Blue Triangle)" },
      { "option_id": "D", "content": "Shape 4 (Red Circle)" },
      { "option_id": "E", "content": "Shape 5 (Blue Square)" }
    ],
    "correct_answer": "D",
    "explanation": "All are blue except the red circle.",
    "time_limit": 45,
    "points": 5,
    "metadata": { "created_date": "2025-08-27", "difficulty_rating": 2.8, "average_time": 25, "success_rate": 0.89 }
  },

  {
    "question_id": "ART_005",
    "test_type": "abstract_reasoning",
    "difficulty": "easy",
    "category": "pattern_matrices",
    "question_content": {
      "type": "visual",
      "pattern_type": "matrix",
      "svg_data": "<svg viewBox='0 0 300 300'><circle cx='50' cy='50' r='20' fill='black'/><rect x='110' y='30' width='40' height='40' fill='black'/><polygon points='180,30 200,70 160,70' fill='black'/><circle cx='50' cy='130' r='20' fill='black'/><rect x='110' y='110' width='40' height='40' fill='black'/><polygon points='180,110 200,150 160,150' fill='black'/><circle cx='50' cy='210' r='20' fill='black'/><rect x='110' y='190' width='40' height='40' fill='black'/><text x='180' y='210' font-size='30' fill='black'>?</text></svg>",
      "description": "Each row has circle, square, triangle in order. Which shape completes the matrix?"
    },
    "options": [
      { "option_id": "A", "content": "Circle" },
      { "option_id": "B", "content": "Square" },
      { "option_id": "C", "content": "Triangle" },
      { "option_id": "D", "content": "Hexagon" }
    ],
    "correct_answer": "C",
    "explanation": "Each row must contain all three shapes.",
    "time_limit": 60,
    "points": 5,
    "metadata": { "created_date": "2025-08-27", "difficulty_rating": 3.2, "average_time": 40, "success_rate": 0.7 }
  },

  {
    "question_id": "ART_006",
    "test_type": "abstract_reasoning",
    "difficulty": "medium",
    "category": "pattern_matrices",
    "question_content": {
      "type": "visual",
      "pattern_type": "matrix",
      "svg_data": "<svg viewBox='0 0 400 250'><polygon points='50,50 80,50 65,80' fill='black'/><polygon points='150,35 150,65 120,50' fill='black'/><polygon points='220,50 250,50 235,20' fill='black'/><polygon points='50,150 80,150 65,120' fill='black'/><polygon points='150,135 150,165 180,150' fill='black'/><text x='235' y='150' font-size='30' fill='black'>?</text></svg>",
      "description": "Shapes rotate 90° each step across rows."
    },
    "options": [
      { "option_id": "A", "content": "0° rotation" },
      { "option_id": "B", "content": "90° rotation" },
      { "option_id": "C", "content": "180° rotation" },
      { "option_id": "D", "content": "270° rotation" }
    ],
    "correct_answer": "C",
    "explanation": "The missing shape must continue the 180° rotation sequence.",
    "time_limit": 70,
    "points": 6,
    "metadata": { "created_date": "2025-08-27", "difficulty_rating": 5.0, "average_time": 60, "success_rate": 0.55 }
  },

  {
    "question_id": "ART_007",
    "test_type": "abstract_reasoning",
    "difficulty": "hard",
    "category": "pattern_matrices",
    "question_content": {
      "type": "visual",
      "pattern_type": "matrix",
      "svg_data": "<svg viewBox='0 0 300 300'><rect x='20' y='20' width='40' height='40' fill='blue'/><circle cx='130' cy='40' r='20' fill='red'/><rect x='220' y='20' width='40' height='40' fill='blue'/><circle cx='40' cy='130' r='20' fill='red'/><rect x='110' y='110' width='40' height='40' fill='blue'/><circle cx='230' cy='130' r='20' fill='red'/><rect x='20' y='200' width='40' height='40' fill='blue'/><circle cx='130' cy='220' r='20' fill='red'/><text x='230' y='220' font-size='25' fill='black'>?</text></svg>",
      "description": "Each row alternates shape and color. Find the missing one."
    },
    "options": [
      { "option_id": "A", "content": "Blue Square" },
      { "option_id": "B", "content": "Red Circle" },
      { "option_id": "C", "content": "Blue Triangle" },